<?xml version="1.0" encoding="UTF-8"?>
<!DOCTYPE struct SYSTEM "lcd-struct.dtd" [
  <!ENTITY % xlglen SYSTEM "xlglen.dtd"> %xlglen;
]>
<struct name="transaction">
    <field name="trx_id" size="&TRX_ID_LEN;">BPIWIPEQ</field>
    <field name="type_id" size="&TRX_TYP_LEN;">O</field>
    <field name="rtn_code" size="&RTN_CODE_LEN;"/>
    <field name="rtn_mesg" size="&RTN_MESG_LEN;"/>
    <field name="eqpt_id" size="&EQPT_ID_LEN;"/>
    <field name="eqpt_dsc" size="&EQPT_DSC_LEN;"/>
    <field name="eqpt_cate" size="1"/>
    <field name="recipe_id" size="&RECIPE_ID_LEN;"/>
    <field name="eqpt_stat" size="&EQPT_STAT_LEN;"/>
    <field name="eqpt_stat_dsc" size="&CODE_DSC_LEN;"/>
    <field name="eqpt_mode" size="&EQPT_MODE_LEN;"/>
  	<field name="crr_cnt" size="3"/> 
  <struct name="oary" multiplicity="3000">
    <field name="crr_id" size="&CRR_ID_LEN;"/>
    <field name="ppbox_id" size="&PPBOX_ID_LEN;"/>
    <field name="crr_stat" size="&CRR_STAT_LEN;"/>
    <field name="sgr_id" size="&SGR_ID_LEN;"/>
    <field name="lot_id" size="&LOT_ID_LEN;"/>
    <field name="splt_id" size="&SPLT_ID_LEN;"/>
    <field name="nx_route_cate" size="&CODE_LEN;"/>
    <field name="nx_route_id" size="&ROUTE_ID_LEN;"/>
    <field name="nx_route_ver" size="&ROUTE_VER_LEN;"/>
    <field name="nx_ope_no" size="&OPE_NO_LEN;"/>
    <field name="nx_ope_id" size="&OPE_ID_LEN;"/>
    <field name="nx_ope_dsc" size="&OPE_DSC_LEN;"/>
    <field name="nx_pep_lvl" size="&PEP_LVL_LEN;"/>
    <field name="nx_recipe_id" size="&RECIPE_ID_LEN;"/>
    <field name="nx_proc_id" size="&PROC_ID_LEN;"/>
    <field name="rsv_user_id" size="&USER_ID_LEN;"/>
    <field name="rsv_eqpt_id" size="&EQPT_ID_LEN;"/>
    <field name="rsv_flg" size="&RSV_FLG_LEN;"/>
    <field name="product_id" size="&PRODUCT_ID_LEN;"/>
    <field name="product_dsc" size="&PRODUCT_DSC_LEN;"/>
    <field name="ec_code" size="&EC_CODE_LEN;"/>
    <field name="prty" size="&CODE_LEN;"/>
    <field name="logof_date" size="&DATE_LEN;"/>
    <field name="logof_time" size="&TIME_LEN;"/>
    <field name="sht_cnt" size="&SHT_STAT_LEN;"/>
    <field name="pnl_cnt" size="&PNL_CNT_LEN;"/>
    <field name="man_ope_time" size="&LD_TIME_LEN;"/>
    <field name="qrs_avl_flg" size="1"/>
    <field name="qrs_ope_id" size="&OPE_ID_LEN;"/>
    <field name="qrs_date" size="&DATE_LEN;"/>
    <field name="qrs_time" size="&TIME_LEN;"/>
    <field name="min_qrs_avl_flg" size="1"/>
    <field name="min_qrs_ope_id" size="&OPE_ID_LEN;"/>
    <field name="min_qrs_date" size="&DATE_LEN;"/>
    <field name="min_qrs_time" size="&TIME_LEN;"/>
    <field name="xf_cmd_stat" size="1"/>
    <field name="position" size="&EQPT_ID_LEN;"/>
    <field name="lot_note_flg" size="1"/>
    <field name="ld_crr_asgn_mode" size="1"/>
    <field name="assign_valid" size="1"/>
    <field name="max_qrk_avl_flg" size="1"/>
    <field name="max_qrk_ope_id" size="&OPE_ID_LEN;"/>
    <field name="max_qrk_date" size="&DATE_LEN;"/>
    <field name="max_qrk_time" size="&TIME_LEN;"/>
    <field name="no_xfer_flg" size="1"/>
    <field name="no_xfer_typ" size="1"/>
    <field name="product_cate" size="&CODE_LEN;"/>
    <field name="owner_id" size="&OWNER_ID_LEN;"/>
    <field name="move_in_flg" size="1"/>
    <field name="worder_id" size="&WORDER_ID_LEN;"/>
    <field name="unit" size="&CODE_LEN;"/>
  </struct>
</struct>