<?xml version="1.0" encoding="UTF-8"?>
<!DOCTYPE struct SYSTEM "lcd-struct.dtd" [
<!ENTITY % xlglen SYSTEM "xlglen.dtd"> %xlglen;
]>
<struct name="transaction">
    <field name="trx_id" size="&TRX_ID_LEN;">BPLICRSH</field>
    <field name="type_id" size="&TRX_TYP_LEN;">O</field>
    <field name="rtn_code" size="&RTN_CODE_LEN;"/>
    <field name="rtn_mesg" size="&RTN_MESG_LEN;"/>
    <field name="eqpt_id" size="&EQPT_ID_LEN;"/>
    <field name="eqpt_dsc" size="&EQPT_DSC_LEN;"/>
    <field name="recipe_id" size="&RECIPE_ID_LEN;"/>
    <field name="eqpt_stat" size="&EQPT_STAT_LEN;"/>
    <field name="eqpt_stat_dsc" size="&CODE_DSC_LEN;"/>
    <field name="eqpt_mode" size="&EQPT_MODE_LEN;"/>
  <field name="crr_cnt" size="4"/>
  <struct name="oary1" multiplicity="3000">
    <field name="crr_id" size="&CRR_ID_LEN;"/>
    <field name="crr_stat" size="&CRR_STAT_LEN;"/>
    <field name="ppbox_id" size="&PPBOX_ID_LEN;"/>
    <field name="cr_route_id" size="&ROUTE_ID_LEN;"/>
    <field name="cr_route_ver" size="&ROUTE_VER_LEN;"/>
    <field name="cr_ope_no" size="&OPE_NO_LEN;"/>
    <field name="cr_ope_id" size="&OPE_ID_LEN;"/>
    <field name="cr_ope_ver" size="&OPE_VER_LEN;"/>
    <field name="cr_pep_lvl" size="&PEP_LVL_LEN;"/>
    <field name="cr_recipe_id" size="&RECIPE_ID_LEN;"/>
    <field name="product_id" size="&PRODUCT_ID_LEN;"/>
    <field name="ec_code" size="&EC_CODE_LEN;"/>
    <field name="prty" size="&CODE_LEN;"/>
    <field name="logon_date" size="&DATE_LEN;"/>
    <field name="logon_time" size="&TIME_LEN;"/>
    <field name="sgr_id" size="&SGR_ID_LEN;"/>
    <field name="lot_id" size="&LOT_ID_LEN;"/>
    <field name="splt_id" size="&SPLT_ID_LEN;"/>
    <field name="cr_ope_dsc" size="&OPE_DSC_LEN;"/>
    <field name="man_ope_time" size="&LD_TIME_LEN;"/>
    <field name="max_qrs_ope_id" size="&OPE_ID_LEN;"/>
    <field name="max_qrs_date" size="&DATE_LEN;"/>
    <field name="max_qrs_time" size="&TIME_LEN;"/>
    <field name="max_qrk_date" size="&DATE_LEN;"/>
    <field name="max_qrk_time" size="&TIME_LEN;"/>
    <field name="min_qrs_ope_id" size="&OPE_ID_LEN;"/>
    <field name="min_qrs_date" size="&DATE_LEN;"/>
    <field name="min_qrs_time" size="&TIME_LEN;"/>
    <field name="min_qrk_date" size="&DATE_LEN;"/>
    <field name="min_qrk_time" size="&TIME_LEN;"/>
    <field name="pnl_cnt" size="&PNL_CNT_LEN;"/>
    <field name="abnd_flg" size="1"/>
    <field name="proc_id" size="&PROC_ID_LEN;"/>
    <field name="pr_flg" size="1"/>
    <field name="unit" size="&CODE_LEN;"/>
    <field name="mes_id" size="&MES_ID_LEN;"/>
    <field name="sht_cnt" size="&SHT_CNT_LEN;"/>
    <struct name="oary2" multiplicity="&MAX_LOT_SHT_CNT;">
	    <field name="sht_id" size="&SHT_ID_LEN;"/>
	    <field name="sgr_id" size="&SGR_ID_LEN;"/>
	    <field name="lot_id" size="&LOT_ID_LEN;"/>
	    <field name="splt_id" size="&SPLT_ID_LEN;"/>
	    <field name="slot_no" size="&SLOT_NO_LEN;"/>
	    <field name="abnd_flg" size="1"/>
    </struct>
  </struct>
</struct>