<?xml version="1.0" encoding="UTF-8"?>
<!DOCTYPE struct SYSTEM "lcd-struct.dtd" [
<!ENTITY % xlglen SYSTEM "xlglen.dtd"> %xlglen;
]>
<struct name="transaction">
    <field name="trx_id" size="&TRX_ID_LEN;">BPLEQALM</field>
    <field name="type_id" size="&TRX_TYP_LEN;">I</field>
    <field name="eqpt_id" size="&EQPT_ID_LEN;"/>
    <field name="cfm_user_id" size="1"/>
    <field name="fr_date" size="&DATE_LEN;"/>
    <field name="fr_time" size="&TIME_LEN;"/>
    <field name="to_date" size="&DATE_LEN;"/>
    <field name="to_time" size="&TIME_LEN;"/>
</struct>