<?xml version="1.0" encoding="UTF-8"?>
<!DOCTYPE struct SYSTEM "lcd-struct.dtd" [
  <!ENTITY % xlglen SYSTEM "xlglen.dtd"> %xlglen;
]>
<struct name="transaction">
    <field name="trx_id" size="&TRX_ID_LEN;">BPIQCRRD</field>
    <field name="type_id" size="&TRX_TYP_LEN;">O</field>
    <field name="rtn_code" size="&RTN_CODE_LEN;"/>
    <field name="rtn_mesg" size="&RTN_MESG_LEN;"/>
    <field name="crr_id" size="&CRR_ID_LEN;"/>
    <field name="sgr_id" size="&SGR_ID_LEN;"/>
    <field name="lot_id" size="&LOT_ID_LEN;"/>
    <field name="splt_id" size="&SPLT_ID_LEN;"/>
    <field name="crr_stat" size="&CRR_STAT_LEN;"/>
    <field name="valid_flg" size="1"/>
    <field name="crr_mnt_rst_date" size="&DATE_LEN;"/>
    <field name="sht_cnt" size="&SHT_CNT_LEN;"/>
    <field name="pnl_cnt" size="&PNL_CNT_LEN;"/>
    <field name="pnl_sht_cnt" size="&PNL_SHT_CNT_LEN;"/>
    <field name="clup_flg" size="1"/>
    <field name="clup_date" size="&DATE_LEN;"/>
    <field name="clup_time" size="&TIME_LEN;"/>
    <field name="real_emp" size="&RELEMP_LEN;"/>
    <field name="product_id" size="&PRODUCT_ID_LEN;"/>
    <field name="ec_code" size="&EC_CODE_LEN;"/>
    <field name="route_cate" size="&CODE_LEN;"/>
    <field name="route_id" size="&ROUTE_ID_LEN;"/>
    <field name="route_ver" size="&ROUTE_VER_LEN;"/>
    <field name="ope_no" size="&OPE_NO_LEN;"/>
    <field name="ope_id" size="&OPE_ID_LEN;"/>
    <field name="ope_ver" size="&OPE_VER_LEN;"/>
    <field name="ope_dsc" size="&OPE_DSC_LEN;"/>
    <field name="stage_id" size="&STAGE_ID_LEN;"/>
    <field name="dept_code" size="&DEPT_CODE_LEN;"/>
    <field name="proc_id" size="&PROC_ID_LEN;"/>
    <field name="proc_dsc" size="&CODE_DSC_LEN;"/>
    <field name="priority" size="&PRIORITY_LEN;"/>
    <field name="eqpt_id" size="&EQPT_ID_LEN;"/>
    <field name="eqpt_port_id" size="&PORT_ID_LEN;"/>
    <field name="eqpt_dsc" size="&EQPT_DSC_LEN;"/>
    <field name="pv_eqpt_id" size="&EQPT_ID_LEN;"/>
    <field name="pep_lvl" size="&PEP_LVL_LEN;"/>
    <field name="recipe_id" size="&RECIPE_ID_LEN;"/>
    <field name="pv_ope_no" size="&OPE_NO_LEN;"/>
    <field name="mproc_id" size="&CODE_LEN;"/>
    <field name="mproc_flg" size="1"/>
    <field name="wip_bank_flg" size="1"/>
    <field name="def_wip_bank_id" size="&EQPT_ID_LEN;"/>
    <field name="shp_bank_flg" size="1"/>
    <field name="crrg_id" size="&CRR_ID_LEN;"/>
    <field name="crr_use_cnt" size="&CRR_USE_CNT_LEN;"/>
    <field name="max_crr_use_cnt" size="&CRR_USE_CNT_LEN;"/>
    <field name="max_use_over_flg" size="1"/>
    <field name="crr_rwk_cnt" size="&RWK_CNT_LEN;"/>
    <field name="mes_id" size="&MES_ID_LEN;"/>
    <field name="area_code" size="&CODE_LEN;"/>
    <field name="mix_owner" size="1"/>
    <field name="owner_id" size="&OWNER_ID_LEN;"/>
    <field name="unit" size="&CODE_LEN;"/>
    <field name="product_cate" size="&CODE_LEN;"/>
    <field name="map_flg" size="1"/>
    <field name="crr_own" size="&CRR_OWN_LEN;"/>
    <field name="cross_flg" size="1"/>
    <field name="crr_rgst_own" size="&CRR_OWN_LEN;"/>
  <field name="qrs_ary_cnt" size="1"/>
  <struct name="oary2" multiplicity="4">
    <field name="qrs_ope_id" size="&OPE_ID_LEN;"/>
    <field name="qrs_typ" size="1"/>
    <field name="qrs_date" size="&DATE_LEN;"/>
    <field name="qrs_time" size="&TIME_LEN;"/>
    <field name="qrk_date" size="&DATE_LEN;"/>
    <field name="qrk_time" size="&TIME_LEN;"/>
  </struct>
  <field name="sht_ary_cnt" size="&LOT_SHT_CNT_LEN;"/>
  <struct name="oary1" multiplicity="&MAX_LOT_SHT_CNT;">
    <field name="sht_id" size="&SHT_ID_LEN;"/>
    <field name="sht_stat" size="&SHT_STAT_LEN;"/>
    <field name="sgr_id" size="&SGR_ID_LEN;"/>
    <field name="lot_id" size="&LOT_ID_LEN;"/>
    <field name="splt_id" size="&SPLT_ID_LEN;"/>
    <field name="slot_no" size="&SLOT_NO_LEN;"/>
    <field name="reproc_flg" size="1"/>
    <field name="sht_note_flg" size="1"/>
    <field name="pnl_cnt" size="&PNL_CNT_LEN;"/>
    <field name="pnl_grade" size="&MAX_SHT_PNL_CNT;"/>
    <field name="rwk_cnt" size="&RWK_CNT_LEN;"/>
    <field name="sht_exist_flg" size="1"/>
    <field name="org_lot_id" size="&LOT_ID_LEN;"/>
    <field name="org_prt_splt_id" size="&SPLT_ID_LEN;"/>
    <field name="org_splt_id" size="&SPLT_ID_LEN;"/>
    <field name="lg_scrp_flg" size="1"/>
    <field name="product_id" size="&PRODUCT_ID_LEN;"/>
    <field name="ec_code" size="&EC_CODE_LEN;"/>
    <field name="route_cate" size="&CODE_LEN;"/>
    <field name="route_id" size="&ROUTE_ID_LEN;"/>
    <field name="route_ver" size="&ROUTE_VER_LEN;"/>
    <field name="ope_no" size="&OPE_NO_LEN;"/>
    <field name="ope_id" size="&OPE_ID_LEN;"/>
    <field name="ope_ver" size="&OPE_VER_LEN;"/>
    <field name="mtrl_grade" size="&MTRL_GRADE_LEN;"/>
    <field name="stb_shop" size="&CODE_LEN;"/>
    <field name="mix_owner" size="1"/>
    <field name="owner_id" size="&OWNER_ID_LEN;"/>
    <field name="stage_id" size="&STAGE_ID_LEN;"/>
    <field name="abn_cnt" size="2"/>
    <struct name="oary3" multiplicity="10">
        <field name="seq_no" size="&SEQ_NO_LEN;"/>
    <field name="abnormal_flg" size="&ABNORMAL_FLG_LEN;"/>
    </struct>
  </struct>
</struct>