<?xml version="1.0" encoding="UTF-8"?>
<!DOCTYPE struct SYSTEM "lcd-struct.dtd" [
<!ENTITY % xlglen SYSTEM "xlglen.dtd"> %xlglen;
]>
<struct name="transaction">
    <field name="trx_id" size="&TRX_ID_LEN;">BPINQSHT</field>
    <field name="type_id" size="&TRX_TYP_LEN;">O</field>
    <field name="rtn_code" size="&RTN_CODE_LEN;"/>
    <field name="rtn_mesg" size="&RTN_MESG_LEN;"/>
    <field name="sht_id" size="&SHT_ID_LEN;"/>
    <field name="sgr_id" size="&SGR_ID_LEN;"/>
    <field name="lot_id" size="&LOT_ID_LEN;"/>
    <field name="splt_id" size="&SPLT_ID_LEN;"/>
    <field name="crr_id" size="&CRR_ID_LEN;"/>
    <field name="slot_no" size="&SLOT_NO_LEN;"/>
    <field name="sht_stat" size="&SHT_STAT_LEN;"/>
    <field name="pnl_cnt" size="&PNL_CNT_LEN;"/>
    <field name="x_axis_cnt" size="&PNL_CNT_LEN;"/>
    <field name="y_axis_cnt" size="&PNL_CNT_LEN;"/>
    <field name="pnl_sht_cnt" size="&PNL_SHT_CNT_LEN;"/>
    <field name="pnl_grade" size="&MAX_SHT_PNL_CNT;"/>
    <field name="reproc_flg" size="1"/>
    <field name="route_id" size="&ROUTE_ID_LEN;"/>
    <field name="route_ver" size="&ROUTE_VER_LEN;"/>
    <field name="ope_no" size="&OPE_NO_LEN;"/>
    <field name="ope_id" size="&OPE_ID_LEN;"/>
    <field name="ope_ver" size="&OPE_VER_LEN;"/>
    <field name="proc_id" size="&PROC_ID_LEN;"/>
    <field name="eqpt_id" size="&EQPT_ID_LEN;"/>
    <field name="eqpt_port_id" size="&PORT_ID_LEN;"/>
    <field name="pep_lvl" size="&PEP_LVL_LEN;"/>
    <field name="recipe_id" size="&RECIPE_ID_LEN;"/>
    <field name="ds_recipe_id" size="&RECIPE_ID_LEN;"/>
    <field name="ac_recipe_id" size="&RECIPE_ID_LEN;"/>
    <field name="mproc_id" size="&CODE_LEN;"/>
    <field name="mproc_flg" size="1"/>
    <field name="abnd_flg" size="1"/>
    <field name="deldays" size="&DELAYDAY_LEN;"/>
    <field name="sht_note_flg" size="1"/>
    <field name="fab_id" size="&FAB_ID_LEN;"/>
    <field name="line_id" size="&LINE_ID_LEN;"/>
    <field name="product_id" size="&PRODUCT_ID_LEN;"/>
    <field name="ec_code" size="&EC_CODE_LEN;"/>
    <field name="charge_code" size="&CHARGE_CODE_LEN;"/>
    <field name="owner_id" size="&OWNER_ID_LEN;"/>
    <field name="prty" size="&CODE_LEN;"/>
    <field name="rwk_cnt" size="&RWK_CNT_LEN;"/>
    <field name="sales_order" size="&SALES_ORDER_LEN;"/>
    <field name="project_cd" size="&PROJECT_CD_LEN;"/>
    <field name="eng_name" size="&USER_DSC_LEN;"/>
    <field name="exp_no" size="&EXPER_NO_LEN;"/>
    <field name="dest_shop" size="&CODE_LEN;"/>
    <field name="worder_id" size="&WORDER_ID_LEN;"/>
    <field name="unit" size="&CODE_LEN;"/>
  	<field name="qrs_cnt" size="&SHT_QRS_CNT_LEN;"/>
  <struct name="oary1" multiplicity="&MAX_SHT_QRS_CNT;">
    <field name="qrs_ope_id" size="&OPE_ID_LEN;"/>
    <field name="qrs_typ" size="1"/>
    <field name="qrs_date" size="&DATE_LEN;"/>
    <field name="qrs_time" size="&TIME_LEN;"/>
    <field name="qrk_date" size="&DATE_LEN;"/>
    <field name="qrk_time" size="&TIME_LEN;"/>
  </struct>
  <field name="abn_cnt" size="&SHT_ABN_CNT_LEN;"/>
  <struct name="oary2" multiplicity="&MAX_SHT_ABN_CNT;">
    <field name="seq_no" size="&SEQ_NO_LEN;"/>
    <field name="abnormal_flg" size="&ABNORMAL_FLG_LEN;"/>
  </struct>
</struct>