<?xml version="1.0" encoding="UTF-8"?>
<!DOCTYPE struct SYSTEM "lcd-struct.dtd" [
  <!ENTITY % xlglen SYSTEM "xlglen.dtd"> %xlglen;
]>
<struct name="transaction">
    <field name="trx_id" size="&TRX_ID_LEN;">BPLEQALM</field>
    <field name="type_id" size="&TRX_TYP_LEN;">O</field>
    <field name="rtn_code" size="&RTN_CODE_LEN;"/>
    <field name="rtn_mesg" size="&RTN_MESG_LEN;"/>
  <field name="alrt_cnt" size="2"/>
  <struct name="oary" multiplicity="300">
    <field name="eqpt_id" size="&EQPT_ID_LEN;"/>
    <field name="rpt_date" size="&DATE_LEN;"/>
    <field name="rpt_time" size="&TIME_LEN;"/>
    <field name="rpt_source" size="&RPT_SOURCE_LEN;"/>
    <field name="alrt_code" size="&CODE_LEN;"/>
    <field name="alrt_lvl" size="1"/>
    <field name="alert_on_off_flg" size="1"/>
    <field name="alrt_dsc" size="&ALRT_DSC_LEN;"/>
    <field name="cfm_user_id" size="&USER_ID_LEN;"/>
    <field name="cfm_date" size="&DATE_LEN;"/>
    <field name="cfm_time" size="&TIME_LEN;"/>
    <field name="alrt_id" size="&ALRT_ID_LEN;"/>
    <field name="alrt_comment" size="&COMMENT_LEN;"/>
    <field name="cfm_comment" size="&COMMENT_LEN;"/>
  </struct>
</struct>