<?xml version="1.0" encoding="UTF-8"?>
<!DOCTYPE struct SYSTEM "lcd-struct.dtd" [
  <!ENTITY % xlglen SYSTEM "xlglen.dtd"> %xlglen;
]>
<struct name="transaction">
    <field name="trx_id" size="&TRX_ID_LEN;">BPLSTBAY</field>
    <field name="type_id" size="&TRX_TYP_LEN;">O</field>
    <field name="rtn_code" size="&RTN_CODE_LEN;"/>
    <field name="rtn_mesg" size="&RTN_MESG_LEN;"/>
  <field name="bay_cnt" size="3"/>
  <struct name="oary" multiplicity="100">
    <field name="bay_id" size="&BAY_ID_LEN;"/>
    <field name="bay_dsc" size="&BAY_DSC_LEN;"/>
  </struct>
</struct>