<?xml version="1.0" encoding="UTF-8"?>
<!DOCTYPE struct SYSTEM "lcd-struct.dtd" [
  <!ENTITY % xlglen SYSTEM "xlglen.dtd"> %xlglen;
]>
<struct name="transaction">
    <field name="trx_id" size="&TRX_ID_LEN;">BPINQEQP</field>
    <field name="type_id" size="&TRX_TYP_LEN;">O</field>
    <field name="rtn_code" size="&RTN_CODE_LEN;"/>
    <field name="rtn_mesg" size="&RTN_MESG_LEN;"/>
    <field name="eqpt_id" size="&EQPT_ID_LEN;"/>
    <field name="eqpt_dsc" size="&EQPT_DSC_LEN;"/>
    <field name="unit_typ" size="1"/>
    <field name="root_eqpt_id" size="&EQPT_ID_LEN;"/>
    <field name="prt_eqpt_id" size="&EQPT_ID_LEN;"/>
    <field name="eqpt_typ" size="1"/>
    <field name="eqpt_subtyp" size="1"/>
    <field name="eqpt_cate" size="1"/>
    <field name="kanban" size="&KANBAN_SIZE;"/>
    <field name="bay_id" size="&BAY_ID_LEN;"/>
    <field name="bcs_node" size="&BCS_NODE_LEN;"/>
    <field name="tcs_node" size="&TCS_NODE_LEN;"/>
    <field name="max_sht_cnt" size="&SHT_CNT_SIZE;"/>
    <field name="max_sht_time" size="&SHT_TIME_SIZE;"/>
    <field name="floor_code" size="&FLOOR_CODE_LEN;"/>
    <field name="eqpt_stat" size="&EQPT_STAT_LEN;"/>
    <field name="eqpt_sub_stat" size="&EQPT_STAT_LEN;"/>
    <field name="eqpt_stat_dsc" size="&CODE_DSC_LEN;"/>
    <field name="eqpt_mode" size="&EQPT_MODE_LEN;"/>
    <field name="tcs_on_off" size="&ON_OFF_LEN;"/>
    <field name="agv_mode" size="1"/>
    <field name="cr_recipe_id" size="&RECIPE_ID_LEN;"/>
    <field name="rsv_recipe_id" size="&RECIPE_ID_LEN;"/>
    <field name="grp_recipe_id" size="&RECIPE_ID_LEN;"/>
    <field name="pv_eqpt_sub_stat" size="&EQPT_STAT_LEN;"/>
    <field name="shtng_date" size="&DATE_LEN;"/>
    <field name="shtng_time" size="&TIME_LEN;"/>
    <field name="shtng_user" size="&USER_ID_LEN;"/>
    <field name="pr_sht_cnt" size="&SHT_CNT_SIZE;"/>
    <field name="max_over_cflg" size="1"/>
    <field name="pr_sht_time" size="&SHT_TIME_SIZE;"/>
    <field name="max_over_tflg" size="1"/>
    <field name="rst_sht_date" size="&DATE_TIME_LEN;"/>
    <field name="rst_user_id" size="&USER_ID_LEN;"/>
    <field name="alrt_flg" size="1"/>
    <field name="mtrl_chg_alrt_flg" size="1"/>
    <field name="clm_user" size="&USER_ID_LEN;"/>
    <field name="clm_date" size="&DATE_LEN;"/>
    <field name="clm_time" size="&TIME_LEN;"/>
    <field name="clm_mfsh" size="&MFGSHOP_LEN;"/>
    <field name="mon_start_flg" size="1"/>
    <field name="mon_interval" size="&MON_INTERVAL_LEN;"/>
    <field name="reticle_chk_flg" size="&RETICLE_CHK_LEN;"/>
    <field name="mtrl_chg_alrt_lvl" size="1"/>
    <field name="reticle_set_id" size="&RETICLE_SET_LEN;"/>
    <field name="xfer_triger" size="1"/>
    <field name="tcs_crr_assign" size="1"/>
    <field name="ld_crr_asgn_mode" size="1"/>
    <field name="ul_crr_asgn_mode" size="1"/>
    <field name="ld_agv_mode" size="1"/>
    <field name="ul_agv_mode" size="1"/>
    <field name="rsv_lot_cnt" size="&RSV_LOT_LEN;"/>
    <field name="max_rsv_lot_cnt" size="&RSV_LOT_LEN;"/>
    <field name="disp_prty_sel" size="1"/>
    <field name="ignore_limitation" size="1"/>
    <field name="eqpt_to_eqpt" size="1"/>
    <field name="reticle_chk" size="1"/>
    <field name="force_ret_ld" size="1"/>
    <field name="force_ret_ul" size="1"/>
    <field name="r_time_l" size="&R_TIME_LEN;"/>
    <field name="r_time_u" size="&R_TIME_LEN;"/>
    <field name="s_time_l" size="&S_TIME_LEN;"/>
    <field name="s_time_u" size="&S_TIME_LEN;"/>
    <field name="p_time_l" size="&P_TIME_LEN;"/>
    <field name="p_time_u" size="&P_TIME_LEN;"/>
    <field name="stb_lot_type" size="1"/>
    <field name="buff_flag" size="1"/>
    <field name="buff_id" size="&EQPT_ID_LEN;"/>
    <field name="min_wait_time" size="&MIN_WAIT_TIME_LEN;"/>
    <field name="comment" size="&COMMENT_LEN;"/>
    <field name="vcr_stat" size="&EQPT_STAT_LEN;"/>
    <field name="eqpt_run_mode" size="&CODE_LEN;"/>
    <field name="eqpt_trns_cate" size="&EQPT_TRNS_CATE_LEN;"/>
    <field name="area_code" size="&CODE_LEN;"/>
    <field name="unit_mode" size="&CODE_LEN;"/>
    <field name="max_pull_cnt" size="&MAX_PULL_CNT_LEN;"/>
    <field name="real_product_id" size="&PRODUCT_ID_LEN;"/>
    <field name="port_cnt" size="&EQPT_PT_CNT_LEN;"/>
  <struct name="oary" multiplicity="&MAX_EQPT_PT_CNT;">
    <field name="port_id" size="&PORT_ID_LEN;"/>
    <field name="port_typ" size="1"/>
    <field name="port_stat" size="&PORT_STAT_LEN;"/>
    <field name="port_stat_dsc" size="&CODE_DSC_LEN;"/>
    <field name="port_date" size="&DATE_LEN;"/>
    <field name="port_time" size="&TIME_LEN;"/>
    <field name="agv_mode" size="1"/>
    <field name="sup_stocker_id" size="&EQPT_ID_LEN;"/>
    <field name="ret_stocker_id" size="&EQPT_ID_LEN;"/>
    <field name="xfer_id" size="&TCS_NODE_LEN;"/>
    <field name="xfer_node" size="&TCS_NODE_LEN;"/>
    <field name="allow_stock_out" size="1"/>
    <field name="force_empty_crr" size="1"/>
    <field name="pi_lot_sel_typ" size="1"/>
    <field name="xfer_fail" size="1"/>
    <field name="xfer_fail_to_sup" size="1"/>
    <field name="map_flg" size="1"/>
    <field name="port_mask" size="&PORT_MASK_LEN;"/>
  </struct>
  <field name="batch_cnt" size="&MAX_EQPT_BT_CNT;"/>
  <struct name="oary2" multiplicity="&MAX_EQPT_BT_CNT;">
    <field name="product_id" size="&PRODUCT_ID_LEN;"/>
    <field name="crr_cnt" size="&CRR_CNT_LEN;"/>
  </struct>
  
</struct>