<?xml version="1.0" encoding="UTF-8"?>
<!DOCTYPE struct SYSTEM "lcd-struct.dtd" [
<!ENTITY % xlglen SYSTEM "xlglen.dtd"> %xlglen;
]>
<struct name="transaction">
    <field name="trx_id" size="&TRX_ID_LEN;">BPLWIPEQ</field>
    <field name="type_id" size="&TRX_TYP_LEN;">O</field>
    <field name="rtn_code" size="&RTN_CODE_LEN;"/>
    <field name="rtn_mesg" size="&RTN_MESG_LEN;"/>
    <field name="bay_id" size="&BAY_ID_LEN;"/>
    <field name="bay_dsc" size="&BAY_DSC_LEN;"/>
  <field name="eqpt_cnt" size="4"/>
  <struct name="oary" multiplicity="1000">
    <field name="eqpt_id" size="&EQPT_ID_LEN;"/>
    <field name="eqpt_dsc" size="&EQPT_DSC_LEN;"/>
    <field name="eqpt_subtyp" size="1"/>
    <field name="eqpt_cate" size="1"/>
    <field name="eqpt_stat" size="&EQPT_STAT_LEN;"/>
    <field name="eqpt_sub_stat" size="&EQPT_STAT_LEN;"/>
    <field name="eqpt_stat_dsc" size="&CODE_DSC_LEN;"/>
    <field name="eqpt_mode" size="&EQPT_MODE_LEN;"/>
    <field name="eqpt_run_mode" size="&EQPT_MODE_LEN;"/>
    <field name="cr_recipe_id" size="&RECIPE_ID_LEN;"/>
    <field name="wait_crr_cnt" size="&WIP_CRR_CNT;"/>
    <field name="inpr_crr_cnt" size="&WIP_CRR_CNT;"/>
    <field name="hld_crr_cnt" size="&WIP_CRR_CNT;"/>
    <field name="abnd_cnt" size="&WIP_SHT_CNT;"/>
    <field name="ld_crr_asgn_mode" size="1"/>
    <field name="ul_crr_asgn_mode" size="1"/>
    <field name="ld_agv_mode" size="1"/>
    <field name="ul_agv_mode" size="1"/>
    <field name="floor_code" size="&FLOOR_CODE_LEN;"/>
    <field name="mtrl_assign_mode" size="1"/>
    <field name="r_time_l" size="&R_TIME_LEN;"/>
    <field name="r_time_u" size="&R_TIME_LEN;"/>
    <field name="s_time_l" size="&S_TIME_LEN;"/>
    <field name="s_time_u" size="&S_TIME_LEN;"/>
    <field name="force_ret_ld" size="1"/>
    <field name="force_ret_ul" size="1"/>
    <field name="area_code" size="&CODE_LEN;"/>
    <field name="unit_mode" size="&CODE_LEN;"/>
  </struct>
</struct>