<?xml version="1.0" encoding="UTF-8"?>
<!DOCTYPE struct SYSTEM "lcd-struct.dtd" [
  <!ENTITY % xlglen SYSTEM "xlglen.dtd"> %xlglen;
]>
<struct name="transaction">
    <field name="trx_id" size="&TRX_ID_LEN;">BPIEQPHS</field>
    <field name="type_id" size="&TRX_TYP_LEN;">O</field>
    <field name="rtn_code" size="&RTN_CODE_LEN;"/>
    <field name="rtn_mesg" size="&RTN_MESG_LEN;"/>
    <field name="eqp_not_cnt" size="3"/>
  <struct name="oary1" multiplicity="100">
    <field name="clm_date" size="&DATE_LEN;"/>
    <field name="clm_time" size="&TIME_LEN;"/>
    <field name="user_id" size="&USER_ID_LEN;"/>
    <field name="eqpt_mode" size="&EQPT_MODE_LEN;"/>
    <field name="eqpt_stat" size="&EQPT_STAT_LEN;"/>
    <field name="eqpt_sub_stat" size="&EQPT_STAT_LEN;"/>
    <field name="eqpt_stat_dsc" size="&CODE_DSC_LEN;"/>
    <field name="comment" size="&COMMENT_LEN;"/>
  </struct>
</struct>